{
  "$schema": "http://json-schema.org/draft-07/schema#",
  "$id": "https://raw.githubusercontent.com/wazobiatech/permission-contract/main/permissions.schema.json",
  "title": "Nexus Permission Contract",
  "description": "Schema for permissions.json — the canonical role → permission map. Validated in CI before any contract version is tagged. v1.3.0 schema: perms are objects with `name` and `scope` (one of self, platform, project, platform/project).",
  "type": "object",
  "required": ["version", "services", "roles", "permissions", "role_permissions"],
  "properties": {
    "version": {
      "type": "string",
      "pattern": "^\\d+\\.\\d+\\.\\d+$",
      "description": "Semver. Bumped on any contract change. SDKs pin to a specific version."
    },
    "description": { "type": "string" },
    "naming_convention": { "type": "string" },
    "services": {
      "type": "array",
      "minItems": 1,
      "uniqueItems": true,
      "items": {
        "type": "string",
        "pattern": "^[a-z][a-z0-9_-]*$"
      }
    },
    "roles": {
      "type": "array",
      "minItems": 1,
      "uniqueItems": true,
      "items": {
        "type": "string",
        "pattern": "^[A-Z][A-Z0-9_]*$"
      }
    },
    "permissions": {
      "description": "Perm vocabulary. Each service maps to an array of perm objects. Each perm has a `name` (matching the platform's {service}:{resource}:{action} convention) and a `scope` (one of: self, platform, project, platform/project).",
      "type": "object",
      "additionalProperties": {
        "type": "array",
        "uniqueItems": true,
        "items": { "$ref": "#/definitions/perm" }
      }
    },
    "role_permissions": {
      "description": "Static role → permission map. Only contains `platform` and `platform/project` scope perms; `self` perms are universal (resolver grants them implicitly); `project` perms are tenant-user only (granted via TenantRole, not in this map).",
      "type": "object",
      "additionalProperties": {
        "type": "object",
        "required": ["permissions"],
        "additionalProperties": false,
        "properties": {
          "inherits_from": {
            "oneOf": [
              { "type": "null" },
              { "type": "string" }
            ]
          },
          "permissions": {
            "type": "array",
            "uniqueItems": true,
            "items": {
              "type": "string",
              "pattern": "^[a-z][a-z0-9_-]*:[a-z][a-z0-9_-]*:[a-z][a-z0-9_-]*$"
            }
          }
        }
      }
    },
    "owner_only_permissions": {
      "description": "Optional helper field. Lists platform-scope perms that should appear ONLY in OWNER's role_permissions. Validated against role_permissions by scripts/validate.mjs. (Destructive perms — no delegation to ADMIN.)",
      "type": "array",
      "uniqueItems": true,
      "items": {
        "type": "string",
        "pattern": "^[a-z][a-z0-9_-]*:[a-z][a-z0-9_-]*:[a-z][a-z0-9_-]*$"
      }
    }
  },
  "definitions": {
    "perm": {
      "type": "object",
      "required": ["name", "scope"],
      "additionalProperties": false,
      "properties": {
        "name": {
          "type": "string",
          "pattern": "^[a-z][a-z0-9_-]*:[a-z][a-z0-9_-]*:[a-z][a-z0-9_-]*$"
        },
        "scope": {
          "type": "string",
          "enum": ["self", "platform", "project", "platform/project"]
        }
      }
    }
  }
}