{
  "$schema": "./permissions.schema.json",
  "version": "1.11.0",
  "description": "Canonical Nexus permission contract. Source of truth for the platform's role \u2192 permission map. v1.3.0 introduced 4 perm scopes (self, platform, project, platform/project) replacing the v1.0.0 default_grant flag. v1.4.0 added the helios:external:* perms for the Use case 2 'tenant brings their own auth' flow (ZIN-4813) \u2014 register / revoke are OWNER-only, view is OWNER+ADMIN. v1.5.0 (ZIN-4902) expands the Mercury vocabulary by 24 perms: split mercury:api_keys:manage into create/revoke/read; add mercury:connection* (slack/oauth/imap with per-provider revoke); add mercury:auth_config* (apple/oauth/forgot_password \u2014 credentials, platform-only); add mercury:user:delete:self, mercury:service_clients:read, mercury:events:consume, mercury:users:batch_read. The schema regex is loosened to allow 3-or-4 colon-delimited segments so sub-resources can be encoded in segment 3 (e.g. mercury:connection_slack:revoke:self). All new Mercury perms are scope `platform` or `self` \u2014 Mercury is fundamentally a platform-level service with no TenantRole-delegable perms. v1.6.0 (ZIN-5068) adds the zeta:* permission vocabulary (14 perms, all scope `project`) for the SnapMyFine B2B fleet management portal. All zeta perms are project-scoped \u2014 they are delegated to B2B tenant roles (Fleet Manager, Finance, Driver) via Helios TenantRole. zeta:billing:manage and zeta:tenant:configure are owner-only. v1.7.0 (ZIN-5232) adds 17 new muse perms and bumps muse:posts:delete from project to platform/project. New perms cover blog update/delete (delete is OWNER-only via owner_only_permissions), author update, tag/category/redirect CRUD (the last three resources are all platform/project, dual-track grantable), redirect analytics, and posts:revert. muse:blog:delete is added to owner_only_permissions (6 entries). The previously project-scoped muse:posts:delete is now platform/project so it can be granted via role_permissions to OWNER/ADMIN/EDITOR (it would otherwise be unreachable via TenantRole since muse posts are platform-owned). v1.9.2 corrects an owner_only_permissions regression: muse:author:delete is moved out of owner_only_permissions and granted to OWNER+ADMIN+EDITOR (matching the other 3 muse:author:* perms, all of which are platform/project). muse:blog:delete remains the only muse destructive perm in owner_only_permissions. Also adds 3 muse:faq:* perms (create/update/delete, all platform/project) that were first published in the v1.9.1 tag but without a corresponding version bump. v1.10.0 adds the prometheus permission vocabulary (8 perms): 4 platform/project prometheus:forms:* perms (create/read/update/delete; delete is OWNER-only via role_permissions, not owner_only_permissions so the dual-track grant via TenantRole stays open), and 4 platform prometheus:responses:* perms (read/update/delete/analytics; update + delete are OWNER+ADMIN only). prometheus:responses:create is intentionally NOT defined — the submit_response tool is fully public (anonymous form-fill is a product requirement) and uses a separate submission_secret capability-URL pattern. Consumed by helios-permissions SDKs via codegen at SDK build time. v1.11.0 promotes the 4 prometheus:responses:* perms from scope `platform` to scope `platform/project`. Lets tenant users with a TenantRole granted `prometheus:responses:*` operate on responses inside their own tenant (e.g. content managers triaging submissions) without escalating to a platform-level role. The role_permissions mapping is unchanged — OWNER+ADMIN still have update/delete via role_permissions, EDITOR/VIEWER still have read-only. Validates the dual-track resolver path end-to-end.",
  "naming_convention": "{service}:{resource}:{action} (3 segments; or {service}:{resource_subres}:{action} for 4-segment perms with sub-resources)",
  "services": [
    "athens",
    "mercury",
    "muse",
    "helios",
    "zeta",
    "prometheus"
  ],
  "roles": [
    "OWNER",
    "ADMIN",
    "EDITOR",
    "VIEWER"
  ],
  "permissions": {
    "athens": [
      {
        "name": "athens:project:view",
        "scope": "platform"
      },
      {
        "name": "athens:project:update",
        "scope": "platform"
      },
      {
        "name": "athens:project:delete",
        "scope": "platform"
      },
      {
        "name": "athens:services:enable",
        "scope": "platform"
      },
      {
        "name": "athens:services:disable",
        "scope": "platform"
      },
      {
        "name": "athens:team:invite",
        "scope": "platform"
      },
      {
        "name": "athens:team:remove",
        "scope": "platform"
      }
    ],
    "mercury": [
      {
        "name": "mercury:user:read:self",
        "scope": "self"
      },
      {
        "name": "mercury:user:write:self",
        "scope": "self"
      },
      {
        "name": "mercury:user:delete:self",
        "scope": "self"
      },
      {
        "name": "mercury:users:read",
        "scope": "platform"
      },
      {
        "name": "mercury:users:write",
        "scope": "platform"
      },
      {
        "name": "mercury:users:batch_read",
        "scope": "platform"
      },
      {
        "name": "mercury:api_keys:create",
        "scope": "platform"
      },
      {
        "name": "mercury:api_keys:revoke",
        "scope": "platform"
      },
      {
        "name": "mercury:api_keys:read",
        "scope": "platform"
      },
      {
        "name": "mercury:api_keys:manage",
        "scope": "platform"
      },
      {
        "name": "mercury:service_clients:read",
        "scope": "platform"
      },
      {
        "name": "mercury:auth_config:read",
        "scope": "platform"
      },
      {
        "name": "mercury:auth_config_apple:create",
        "scope": "platform"
      },
      {
        "name": "mercury:auth_config_apple:update",
        "scope": "platform"
      },
      {
        "name": "mercury:auth_config_oauth:create",
        "scope": "platform"
      },
      {
        "name": "mercury:auth_config_oauth:update",
        "scope": "platform"
      },
      {
        "name": "mercury:auth_config_forgot_password:create",
        "scope": "platform"
      },
      {
        "name": "mercury:auth_config_forgot_password:update",
        "scope": "platform"
      },
      {
        "name": "mercury:auth_config_forgot_password:read",
        "scope": "platform"
      },
      {
        "name": "mercury:connection:read:self",
        "scope": "self"
      },
      {
        "name": "mercury:connection_slack:phrase_create:self",
        "scope": "self"
      },
      {
        "name": "mercury:connection_oauth:initiate:self",
        "scope": "self"
      },
      {
        "name": "mercury:connection_oauth:complete:self",
        "scope": "self"
      },
      {
        "name": "mercury:connection_slack:revoke:self",
        "scope": "self"
      },
      {
        "name": "mercury:connection_google:revoke:self",
        "scope": "self"
      },
      {
        "name": "mercury:connection_imap:revoke:self",
        "scope": "self"
      },
      {
        "name": "mercury:connection_imap:create:self",
        "scope": "self"
      },
      {
        "name": "mercury:connection_oauth:refresh",
        "scope": "platform"
      },
      {
        "name": "mercury:events:consume",
        "scope": "platform"
      }
    ],
    "muse": [
      {
        "name": "muse:blog:create",
        "scope": "platform/project"
      },
      {
        "name": "muse:blog:read",
        "scope": "platform/project"
      },
      {
        "name": "muse:blog:update",
        "scope": "platform/project"
      },
      {
        "name": "muse:blog:delete",
        "scope": "platform/project"
      },
      {
        "name": "muse:author:create",
        "scope": "platform/project"
      },
      {
        "name": "muse:author:read",
        "scope": "platform/project"
      },
      {
        "name": "muse:author:update",
        "scope": "platform/project"
      },
      {
        "name": "muse:author:delete",
        "scope": "platform/project"
      },
      {
        "name": "muse:posts:read",
        "scope": "project"
      },
      {
        "name": "muse:posts:write",
        "scope": "project"
      },
      {
        "name": "muse:posts:delete",
        "scope": "platform/project"
      },
      {
        "name": "muse:posts:revert",
        "scope": "platform/project"
      },
      {
        "name": "muse:drafts:read",
        "scope": "project"
      },
      {
        "name": "muse:drafts:write",
        "scope": "project"
      },
      {
        "name": "muse:tag:create",
        "scope": "platform/project"
      },
      {
        "name": "muse:tag:read",
        "scope": "platform/project"
      },
      {
        "name": "muse:tag:update",
        "scope": "platform/project"
      },
      {
        "name": "muse:tag:delete",
        "scope": "platform/project"
      },
      {
        "name": "muse:category:create",
        "scope": "platform/project"
      },
      {
        "name": "muse:category:read",
        "scope": "platform/project"
      },
      {
        "name": "muse:category:update",
        "scope": "platform/project"
      },
      {
        "name": "muse:category:delete",
        "scope": "platform/project"
      },
      {
        "name": "muse:redirect:create",
        "scope": "platform/project"
      },
      {
        "name": "muse:redirect:read",
        "scope": "platform/project"
      },
      {
        "name": "muse:redirect:update",
        "scope": "platform/project"
      },
      {
        "name": "muse:redirect:delete",
        "scope": "platform/project"
      },
      {
        "name": "muse:redirect:analytics",
        "scope": "platform/project"
      },
      {
        "name": "muse:faq:create",
        "scope": "platform/project"
      },
      {
        "name": "muse:faq:update",